smoke create: /opt/stack/tempest/.tox/tempest
smoke installdeps: -chttps://releases.openstack.org/constraints/upper/master, -r/opt/stack/tempest/requirements.txt
smoke develop-inst: /opt/stack/tempest
smoke installed: attrs==25.4.0,autopage==0.5.2,bcrypt==4.3.0,certifi==2026.1.4,cffi==2.0.0,charset-normalizer==3.4.4,cliff==4.13.1,cmd2==2.7.0,cryptography==43.0.3,debtcollector==3.0.0,defusedxml==0.7.1,fasteners==0.20,fixtures==4.2.6,idna==3.11,invoke==2.2.1,iso8601==2.1.0,jsonschema==4.25.1,jsonschema-specifications==2025.9.1,markdown-it-py==4.0.0,mdurl==0.1.2,msgpack==1.1.2,netaddr==1.3.0,oslo.concurrency==7.2.0,oslo.config==10.2.0,oslo.context==6.2.0,oslo.i18n==6.7.1,oslo.log==8.0.0,oslo.serialization==5.9.0,oslo.utils==9.2.0,packaging==25.0,paramiko==4.0.0,pbr==7.0.3,prettytable==3.16.0,psutil==7.1.1,pycparser==2.23,Pygments==2.19.2,PyNaCl==1.6.0,pyparsing==3.2.5,pyperclip==1.11.0,python-dateutil==2.9.0.post0,python-subunit==1.4.4,PyYAML==6.0.3,referencing==0.37.0,requests==2.32.5,rfc3986==2.0.0,rich==14.2.0,rich-argparse==1.7.1,rpds-py==0.28.0,setuptools==80.10.1,six==1.17.0,stestr==4.2.0,stevedore==5.6.0,-e git+https://opendev.org/openstack/tempest.git@8ccefd4bea48d6b38f7e16c50f97931b3fc2a5e2#egg=tempest,testscenarios==0.5.0,testtools==2.7.2,tomlkit==0.13.3,typing_extensions==4.15.0,tzdata==2025.2,urllib3==1.26.20,voluptuous==0.15.2,wcwidth==0.2.14,wrapt==2.0.0
smoke run-test-pre: PYTHONHASHSEED='1698375405'
smoke run-test: commands[0] | find . -type f -name '*.pyc' -delete
smoke run-test: commands[1] | tempest run --regex '\[.*\bsmoke\b.*\]'
{1} setUpClass (tempest.api.object_storage.test_container_services.ContainerTest) ... SKIPPED: ContainerTest skipped as swift is not available
{3} setUpClass (tempest.api.object_storage.test_object_services.ObjectTest) ... SKIPPED: ObjectTest skipped as swift is not available
{2} setUpClass (tempest.api.object_storage.test_account_quotas.AccountQuotasTest) ... SKIPPED: AccountQuotasTest skipped as swift is not available
{35} tempest.api.identity.v3.test_domains.DefaultDomainTestJSON.test_default_domain_exists [0.120327s] ... ok
{32} tempest.api.identity.v3.test_api_discovery.TestApiDiscovery.test_api_media_types [0.185001s] ... ok
{32} tempest.api.identity.v3.test_api_discovery.TestApiDiscovery.test_api_version_resources [0.157434s] ... ok
{34} tempest.api.compute.flavors.test_flavors.FlavorsV2TestJSON.test_get_flavor [0.390962s] ... ok
{32} tempest.api.identity.v3.test_api_discovery.TestApiDiscovery.test_api_version_statuses [0.174986s] ... ok
{34} tempest.api.compute.flavors.test_flavors.FlavorsV2TestJSON.test_list_flavors [0.097176s] ... ok
{32} tempest.api.identity.v3.test_api_discovery.TestApiDiscovery.test_list_api_versions [0.035155s] ... ok
{23} tempest.api.image.v2.test_images.BasicOperationsImagesTest.test_delete_image [1.089522s] ... ok
{30} tempest.api.identity.admin.v3.test_policies.PoliciesTestJSON.test_create_update_delete_policy [0.279766s] ... ok
{20} tempest.api.network.test_versions.NetworksApiDiscovery.test_api_version_resources [1.307324s] ... ok
{28} tempest.api.identity.admin.v3.test_services.ServicesTestJSON.test_create_update_get_service [0.323365s] ... ok
{33} tempest.api.identity.admin.v3.test_regions.RegionsTestJSON.test_create_region_with_specific_id [0.400460s] ... ok
{31} tempest.api.identity.admin.v3.test_credentials.CredentialsTestJSON.test_credentials_create_get_update_delete [0.458933s] ... ok
{26} tempest.api.identity.admin.v3.test_domains.DomainsTestJSON.test_create_update_delete_domain [0.938287s] ... ok
{29} tempest.api.identity.admin.v3.test_roles.RolesV3TestJSON.test_role_create_update_show_list [0.391473s] ... ok
{27} tempest.api.identity.admin.v3.test_endpoints.EndPointsTestJSON.test_update_endpoint [1.146321s] ... ok
{20} tempest.api.network.test_versions.NetworksApiDiscovery.test_show_api_v2_details [1.468204s] ... ok
{22} tempest.api.identity.admin.v3.test_trusts.TrustsV3TestJSON.test_get_trusts_all [2.174604s] ... ok
{23} tempest.api.image.v2.test_images.BasicOperationsImagesTest.test_register_upload_get_image_file [2.110870s] ... ok
{21} tempest.api.identity.admin.v3.test_groups.GroupsV3TestJSON.test_group_users_add_list_delete [2.360685s] ... ok
{23} tempest.api.image.v2.test_images.BasicOperationsImagesTest.test_update_image [0.722067s] ... ok
{10} tempest.api.network.test_networks.BulkNetworkOpsIpV6Test.test_bulk_create_delete_network [8.750289s] ... ok
{18} tempest.api.network.test_subnetpools_extensions.SubnetPoolsTestJSON.test_create_list_show_update_delete_subnetpools [8.527428s] ... ok
{13} tempest.api.network.test_security_groups.SecGroupTest.test_create_list_update_show_delete_security_group [9.616645s] ... ok
{9} tempest.api.network.test_networks.BulkNetworkOpsTest.test_bulk_create_delete_network [10.160281s] ... ok
{12} tempest.api.network.test_security_groups.SecGroupIPv6Test.test_create_list_update_show_delete_security_group [10.108642s] ... ok
{7} tempest.api.volume.test_volumes_get.VolumesGetTest.test_volume_create_get_update_delete [12.493215s] ... ok
{16} tempest.api.network.test_networks.NetworksTest.test_create_update_delete_network_subnet [9.898712s] ... ok
{15} tempest.api.network.test_ports.PortsTestJSON.test_create_port_in_allowed_allocation_pools [10.633552s] ... ok
{14} tempest.api.network.test_ports.PortsIpV6TestJSON.test_create_port_in_allowed_allocation_pools [11.038668s] ... ok
{17} tempest.api.network.test_networks.NetworksIpV6Test.test_create_update_delete_network_subnet [9.875814s] ... ok
{24} tempest.api.compute.security_groups.test_security_group_rules.SecurityGroupRulesTestJSON.test_security_group_rules_create [2.143680s] ... ok
{16} tempest.api.network.test_networks.NetworksTest.test_external_network_visibility [1.389777s] ... ok
{17} tempest.api.network.test_networks.NetworksIpV6Test.test_external_network_visibility [1.046266s] ... ok
{16} tempest.api.network.test_networks.NetworksTest.test_list_networks [0.234410s] ... ok
{17} tempest.api.network.test_networks.NetworksIpV6Test.test_list_networks [0.222573s] ... ok
{17} tempest.api.network.test_networks.NetworksIpV6Test.test_list_subnets [0.310451s] ... ok
{9} tempest.api.network.test_networks.BulkNetworkOpsTest.test_bulk_create_delete_port [6.238075s] ... ok
{16} tempest.api.network.test_networks.NetworksTest.test_list_subnets [0.603222s] ... ok
{17} tempest.api.network.test_networks.NetworksIpV6Test.test_show_network [0.182723s] ... ok
{17} tempest.api.network.test_networks.NetworksIpV6Test.test_show_subnet [0.163034s] ... ok
{16} tempest.api.network.test_networks.NetworksTest.test_show_network [0.206858s] ... ok
{16} tempest.api.network.test_networks.NetworksTest.test_show_subnet [0.122810s] ... ok
{10} tempest.api.network.test_networks.BulkNetworkOpsIpV6Test.test_bulk_create_delete_port [8.006067s] ... ok
{24} tempest.api.compute.security_groups.test_security_group_rules.SecurityGroupRulesTestJSON.test_security_group_rules_list [2.529609s] ... ok
{13} tempest.api.network.test_security_groups.SecGroupTest.test_create_show_delete_security_group_rule [8.258769s] ... ok
{14} tempest.api.network.test_ports.PortsIpV6TestJSON.test_create_port_with_no_securitygroups [3.268416s] ... ok
{13} tempest.api.network.test_security_groups.SecGroupTest.test_list_security_groups [0.171215s] ... ok
{15} tempest.api.network.test_ports.PortsTestJSON.test_create_port_with_no_securitygroups [3.444070s] ... ok
{12} tempest.api.network.test_security_groups.SecGroupIPv6Test.test_create_show_delete_security_group_rule [7.966844s] ... ok
{25} tempest.api.compute.security_groups.test_security_groups.SecurityGroupsTestJSON.test_security_groups_create_list_delete [5.780244s] ... ok
{12} tempest.api.network.test_security_groups.SecGroupIPv6Test.test_list_security_groups [0.151413s] ... ok
{19} tempest.api.network.test_floating_ips.FloatingIPTestJSON.test_create_floating_ip_specifying_a_fixed_ip_address [4.220657s] ... ok
{11} tempest.api.network.test_extensions.ExtensionsTestJSON.test_list_show_extensions [19.173531s] ... ok
{15} tempest.api.network.test_ports.PortsTestJSON.test_create_update_delete_port [1.376467s] ... ok
{10} tempest.api.network.test_networks.BulkNetworkOpsIpV6Test.test_bulk_create_delete_subnet [2.705919s] ... ok
{15} tempest.api.network.test_ports.PortsTestJSON.test_list_ports [0.093080s] ... ok
{14} tempest.api.network.test_ports.PortsIpV6TestJSON.test_create_update_delete_port [1.648831s] ... ok
{15} tempest.api.network.test_ports.PortsTestJSON.test_show_port [0.092292s] ... ok
{14} tempest.api.network.test_ports.PortsIpV6TestJSON.test_list_ports [0.076602s] ... ok
{9} tempest.api.network.test_networks.BulkNetworkOpsTest.test_bulk_create_delete_subnet [3.282735s] ... ok
{14} tempest.api.network.test_ports.PortsIpV6TestJSON.test_show_port [0.065706s] ... ok
{5} tempest.api.network.test_routers.RoutersIpV6Test.test_add_multiple_router_interfaces [21.419656s] ... ok
{8} tempest.scenario.test_dashboard_basic_ops.TestDashboardBasicOps.test_basic_scenario [22.288847s] ... ok
{19} tempest.api.network.test_floating_ips.FloatingIPTestJSON.test_create_list_show_update_delete_floating_ip [3.608010s] ... ok
{5} tempest.api.network.test_routers.RoutersIpV6Test.test_add_remove_router_interface_with_port_id [3.443991s] ... ok
{5} tempest.api.network.test_routers.RoutersIpV6Test.test_add_remove_router_interface_with_subnet_id [2.919784s] ... ok
{4} tempest.api.network.test_routers.RoutersTest.test_add_multiple_router_interfaces [28.293619s] ... ok
{5} tempest.api.network.test_routers.RoutersIpV6Test.test_create_show_list_update_delete_router [2.752644s] ... ok
{5} setUpClass (tempest.scenario.test_server_multinode.TestServerMultinode) ... SKIPPED: Less than 2 compute nodes, skipping multinode tests.
{4} tempest.api.network.test_routers.RoutersTest.test_add_remove_router_interface_with_port_id [4.083864s] ... ok
{39} tempest.api.compute.servers.test_server_addresses.ServerAddressesTestJSON.test_list_server_addresses [0.049144s] ... ok
{7} tempest.api.volume.test_volumes_get.VolumesGetTest.test_volume_create_get_update_delete_from_image [21.037020s] ... ok
{39} tempest.api.compute.servers.test_server_addresses.ServerAddressesTestJSON.test_list_server_addresses_by_network [0.135600s] ... ok
{4} tempest.api.network.test_routers.RoutersTest.test_add_remove_router_interface_with_subnet_id [4.674955s] ... ok
{38} tempest.api.compute.servers.test_create_server.ServersTestJSON.test_list_servers [0.143804s] ... ok
{38} tempest.api.compute.servers.test_create_server.ServersTestJSON.test_verify_server_details [0.000441s] ... ok
{4} tempest.api.network.test_routers.RoutersTest.test_create_show_list_update_delete_router [2.931147s] ... ok
{4} setUpClass (tempest.api.object_storage.test_account_services.AccountTest) ... SKIPPED: AccountTest skipped as swift is not available
{36} tempest.api.compute.servers.test_create_server.ServersTestManualDisk.test_list_servers [0.143091s] ... ok
{36} tempest.api.compute.servers.test_create_server.ServersTestManualDisk.test_verify_server_details [0.000528s] ... ok
{1} tempest.api.volume.test_volumes_actions.VolumesActionsTest.test_attach_detach_volume_to_instance [29.998154s] ... ok
{39} tempest.api.compute.test_versions.TestVersions.test_get_version_details [0.027807s] ... ok
{39} tempest.api.compute.test_versions.TestVersions.test_list_api_versions [0.008377s] ... ok
{38} tempest.api.volume.test_volumes_list.VolumesListTestJSON.test_volume_list [0.048462s] ... ok
{37} tempest.api.compute.servers.test_create_server.ServersTestBootFromVolume.test_list_servers [0.057957s] ... ok
{37} tempest.api.compute.servers.test_create_server.ServersTestBootFromVolume.test_verify_server_details [0.000671s] ... ok
{0} tempest.api.compute.servers.test_attach_interfaces.AttachInterfacesUnderV243Test.test_add_remove_fixed_ip [52.254008s] ... ok
{0} setUpClass (tempest.api.object_storage.test_container_quotas.ContainerQuotasTest) ... SKIPPED: ContainerQuotasTest skipped as swift is not available
{3} tempest.scenario.test_server_basic_ops.TestServerBasicOps.test_server_basic_ops [47.635225s] ... ok
{37} tempest.api.image.v2.test_versions.VersionsTest.test_list_versions [0.004819s] ... ok
{37} tempest.api.volume.test_versions.VersionsTest.test_list_versions [0.007764s] ... ok
{6} tempest.api.compute.servers.test_server_actions.ServerActionsTestJSON.test_reboot_server_hard [19.536065s] ... ok
{2} tempest.scenario.test_network_basic_ops.TestNetworkBasicOps.test_network_basic_ops [94.002534s] ... ok

======
Totals
======
Ran: 97 tests in 96.8086 sec.
 - Passed: 91
 - Skipped: 6
 - Expected Fail: 0
 - Unexpected Success: 0
 - Failed: 0
Sum of execute time for each test: 564.1205 sec.

==============
Worker Balance
==============
 - Worker 0 (2 tests) => 0:00:54.590235
 - Worker 1 (2 tests) => 0:00:43.725669
 - Worker 2 (2 tests) => 0:01:36.751761
 - Worker 3 (2 tests) => 0:01:07.422055
 - Worker 4 (5 tests) => 0:00:40.683209
 - Worker 5 (5 tests) => 0:00:31.254290
 - Worker 6 (1 tests) => 0:00:19.536065
 - Worker 7 (2 tests) => 0:00:33.536258
 - Worker 8 (1 tests) => 0:00:22.288847
 - Worker 9 (3 tests) => 0:00:19.690354
 - Worker 10 (3 tests) => 0:00:19.472299
 - Worker 11 (1 tests) => 0:00:19.173531
 - Worker 12 (3 tests) => 0:00:18.234573
 - Worker 13 (3 tests) => 0:00:18.054042
 - Worker 14 (5 tests) => 0:00:16.106778
 - Worker 15 (5 tests) => 0:00:15.647848
 - Worker 16 (6 tests) => 0:00:12.464696
 - Worker 17 (6 tests) => 0:00:11.814423
 - Worker 18 (1 tests) => 0:00:08.527428
 - Worker 19 (2 tests) => 0:00:07.838051
 - Worker 20 (2 tests) => 0:00:02.782633
 - Worker 21 (1 tests) => 0:00:02.360685
 - Worker 22 (1 tests) => 0:00:02.174604
 - Worker 23 (3 tests) => 0:00:03.930124
 - Worker 24 (2 tests) => 0:00:04.678911
 - Worker 25 (1 tests) => 0:00:05.780244
 - Worker 26 (1 tests) => 0:00:00.938287
 - Worker 27 (1 tests) => 0:00:01.146321
 - Worker 28 (1 tests) => 0:00:00.323365
 - Worker 29 (1 tests) => 0:00:00.391473
 - Worker 30 (1 tests) => 0:00:00.279766
 - Worker 31 (1 tests) => 0:00:00.458933
 - Worker 32 (4 tests) => 0:00:00.561778
 - Worker 33 (1 tests) => 0:00:00.400460
 - Worker 34 (2 tests) => 0:00:00.495714
 - Worker 35 (1 tests) => 0:00:00.120327
 - Worker 36 (2 tests) => 0:00:00.150539
 - Worker 37 (4 tests) => 0:00:14.790355
 - Worker 38 (3 tests) => 0:00:14.225076
 - Worker 39 (4 tests) => 0:00:10.229285
___________________________________ summary ____________________________________
  smoke: commands succeeded
  congratulations :)
