smoke create: /opt/stack/tempest/.tox/tempest
smoke installdeps: -chttps://releases.openstack.org/constraints/upper/master, -r/opt/stack/tempest/requirements.txt
smoke develop-inst: /opt/stack/tempest
smoke installed: attrs==25.4.0,autopage==0.5.2,bcrypt==4.3.0,certifi==2026.1.4,cffi==2.0.0,charset-normalizer==3.4.4,cliff==4.13.1,cmd2==2.7.0,cryptography==43.0.3,debtcollector==3.0.0,defusedxml==0.7.1,fasteners==0.20,fixtures==4.2.6,idna==3.11,invoke==2.2.1,iso8601==2.1.0,jsonschema==4.25.1,jsonschema-specifications==2025.9.1,markdown-it-py==4.0.0,mdurl==0.1.2,msgpack==1.1.2,netaddr==1.3.0,oslo.concurrency==7.2.0,oslo.config==10.2.0,oslo.context==6.2.0,oslo.i18n==6.7.1,oslo.log==8.0.0,oslo.serialization==5.9.0,oslo.utils==9.2.0,packaging==25.0,paramiko==4.0.0,pbr==7.0.3,prettytable==3.16.0,psutil==7.1.1,pycparser==2.23,Pygments==2.19.2,PyNaCl==1.6.0,pyparsing==3.2.5,pyperclip==1.11.0,python-dateutil==2.9.0.post0,python-subunit==1.4.4,PyYAML==6.0.3,referencing==0.37.0,requests==2.32.5,rfc3986==2.0.0,rich==14.2.0,rich-argparse==1.7.1,rpds-py==0.28.0,setuptools==80.10.1,six==1.17.0,stestr==4.2.0,stevedore==5.6.0,-e git+https://opendev.org/openstack/tempest.git@8ccefd4bea48d6b38f7e16c50f97931b3fc2a5e2#egg=tempest,testscenarios==0.5.0,testtools==2.7.2,tomlkit==0.13.3,typing_extensions==4.15.0,tzdata==2025.2,urllib3==1.26.20,voluptuous==0.15.2,wcwidth==0.2.14,wrapt==2.0.0
smoke run-test-pre: PYTHONHASHSEED='4229945399'
smoke run-test: commands[0] | find . -type f -name '*.pyc' -delete
smoke run-test: commands[1] | tempest run --regex '\[.*\bsmoke\b.*\]'
{1} setUpClass (tempest.api.object_storage.test_account_quotas.AccountQuotasTest) ... SKIPPED: AccountQuotasTest skipped as swift is not available
{2} setUpClass (tempest.api.object_storage.test_object_services.ObjectTest) ... SKIPPED: ObjectTest skipped as swift is not available
{32} tempest.api.identity.v3.test_api_discovery.TestApiDiscovery.test_api_media_types [0.173945s] ... ok
{35} tempest.api.identity.v3.test_domains.DefaultDomainTestJSON.test_default_domain_exists [0.125011s] ... ok
{32} tempest.api.identity.v3.test_api_discovery.TestApiDiscovery.test_api_version_resources [0.141476s] ... ok
{32} tempest.api.identity.v3.test_api_discovery.TestApiDiscovery.test_api_version_statuses [0.082576s] ... ok
{34} tempest.api.compute.flavors.test_flavors.FlavorsV2TestJSON.test_get_flavor [0.384985s] ... ok
{32} tempest.api.identity.v3.test_api_discovery.TestApiDiscovery.test_list_api_versions [0.074549s] ... ok
{34} tempest.api.compute.flavors.test_flavors.FlavorsV2TestJSON.test_list_flavors [0.085163s] ... ok
{21} tempest.api.network.test_versions.NetworksApiDiscovery.test_api_version_resources [1.127817s] ... ok
{23} tempest.api.image.v2.test_images.BasicOperationsImagesTest.test_delete_image [1.107035s] ... ok
{31} tempest.api.identity.admin.v3.test_policies.PoliciesTestJSON.test_create_update_delete_policy [0.284531s] ... ok
{29} tempest.api.identity.admin.v3.test_services.ServicesTestJSON.test_create_update_get_service [0.424229s] ... ok
{33} tempest.api.identity.admin.v3.test_regions.RegionsTestJSON.test_create_region_with_specific_id [0.176415s] ... ok
{28} tempest.api.identity.admin.v3.test_credentials.CredentialsTestJSON.test_credentials_create_get_update_delete [0.480949s] ... ok
{30} tempest.api.identity.admin.v3.test_roles.RolesV3TestJSON.test_role_create_update_show_list [0.399989s] ... ok
{27} tempest.api.identity.admin.v3.test_domains.DomainsTestJSON.test_create_update_delete_domain [0.928502s] ... ok
{21} tempest.api.network.test_versions.NetworksApiDiscovery.test_show_api_v2_details [1.749590s] ... ok
{26} tempest.api.identity.admin.v3.test_endpoints.EndPointsTestJSON.test_update_endpoint [1.246505s] ... ok
{22} tempest.api.identity.admin.v3.test_trusts.TrustsV3TestJSON.test_get_trusts_all [2.309816s] ... ok
{23} tempest.api.image.v2.test_images.BasicOperationsImagesTest.test_register_upload_get_image_file [1.967506s] ... ok
{20} tempest.api.identity.admin.v3.test_groups.GroupsV3TestJSON.test_group_users_add_list_delete [2.286895s] ... ok
{23} tempest.api.image.v2.test_images.BasicOperationsImagesTest.test_update_image [0.992111s] ... ok
{17} tempest.api.network.test_subnetpools_extensions.SubnetPoolsTestJSON.test_create_list_show_update_delete_subnetpools [7.885479s] ... ok
{8} tempest.api.network.test_networks.BulkNetworkOpsTest.test_bulk_create_delete_network [8.781039s] ... ok
{9} tempest.api.network.test_networks.BulkNetworkOpsIpV6Test.test_bulk_create_delete_network [11.373939s] ... ok
{11} tempest.api.network.test_security_groups.SecGroupTest.test_create_list_update_show_delete_security_group [11.477191s] ... ok
{12} tempest.api.network.test_security_groups.SecGroupIPv6Test.test_create_list_update_show_delete_security_group [11.365032s] ... ok
{7} tempest.api.volume.test_volumes_get.VolumesGetTest.test_volume_create_get_update_delete [12.488778s] ... ok
{15} tempest.api.network.test_networks.NetworksTest.test_create_update_delete_network_subnet [9.300107s] ... ok
{16} tempest.api.network.test_networks.NetworksIpV6Test.test_create_update_delete_network_subnet [9.633892s] ... ok
{25} tempest.api.compute.security_groups.test_security_group_rules.SecurityGroupRulesTestJSON.test_security_group_rules_create [2.105677s] ... ok
{13} tempest.api.network.test_ports.PortsTestJSON.test_create_port_in_allowed_allocation_pools [10.577338s] ... ok
{14} tempest.api.network.test_ports.PortsIpV6TestJSON.test_create_port_in_allowed_allocation_pools [10.310165s] ... ok
{15} tempest.api.network.test_networks.NetworksTest.test_external_network_visibility [1.170900s] ... ok
{16} tempest.api.network.test_networks.NetworksIpV6Test.test_external_network_visibility [1.217018s] ... ok
{15} tempest.api.network.test_networks.NetworksTest.test_list_networks [0.275531s] ... ok
{16} tempest.api.network.test_networks.NetworksIpV6Test.test_list_networks [0.297146s] ... ok
{15} tempest.api.network.test_networks.NetworksTest.test_list_subnets [0.319750s] ... ok
{16} tempest.api.network.test_networks.NetworksIpV6Test.test_list_subnets [0.192382s] ... ok
{15} tempest.api.network.test_networks.NetworksTest.test_show_network [0.282567s] ... ok
{16} tempest.api.network.test_networks.NetworksIpV6Test.test_show_network [0.252046s] ... ok
{8} tempest.api.network.test_networks.BulkNetworkOpsTest.test_bulk_create_delete_port [6.805220s] ... ok
{15} tempest.api.network.test_networks.NetworksTest.test_show_subnet [0.160830s] ... ok
{16} tempest.api.network.test_networks.NetworksIpV6Test.test_show_subnet [0.175719s] ... ok
{9} tempest.api.network.test_networks.BulkNetworkOpsIpV6Test.test_bulk_create_delete_port [4.761249s] ... ok
{25} tempest.api.compute.security_groups.test_security_group_rules.SecurityGroupRulesTestJSON.test_security_group_rules_list [2.993649s] ... ok
{18} tempest.api.network.test_floating_ips.FloatingIPTestJSON.test_create_floating_ip_specifying_a_fixed_ip_address [3.189430s] ... ok
{14} tempest.api.network.test_ports.PortsIpV6TestJSON.test_create_port_with_no_securitygroups [3.270399s] ... ok
{24} tempest.api.compute.security_groups.test_security_groups.SecurityGroupsTestJSON.test_security_groups_create_list_delete [6.812845s] ... ok
{12} tempest.api.network.test_security_groups.SecGroupIPv6Test.test_create_show_delete_security_group_rule [6.032101s] ... ok
{12} tempest.api.network.test_security_groups.SecGroupIPv6Test.test_list_security_groups [0.135974s] ... ok
{13} tempest.api.network.test_ports.PortsTestJSON.test_create_port_with_no_securitygroups [3.775026s] ... ok
{11} tempest.api.network.test_security_groups.SecGroupTest.test_create_show_delete_security_group_rule [6.563774s] ... ok
{11} tempest.api.network.test_security_groups.SecGroupTest.test_list_security_groups [0.064208s] ... ok
{13} tempest.api.network.test_ports.PortsTestJSON.test_create_update_delete_port [1.091443s] ... ok
{13} tempest.api.network.test_ports.PortsTestJSON.test_list_ports [0.070277s] ... ok
{8} tempest.api.network.test_networks.BulkNetworkOpsTest.test_bulk_create_delete_subnet [3.364478s] ... ok
{13} tempest.api.network.test_ports.PortsTestJSON.test_show_port [0.036230s] ... ok
{9} tempest.api.network.test_networks.BulkNetworkOpsIpV6Test.test_bulk_create_delete_subnet [2.974349s] ... ok
{10} tempest.api.network.test_extensions.ExtensionsTestJSON.test_list_show_extensions [19.142396s] ... ok
{14} tempest.api.network.test_ports.PortsIpV6TestJSON.test_create_update_delete_port [2.235101s] ... ok
{14} tempest.api.network.test_ports.PortsIpV6TestJSON.test_list_ports [0.147949s] ... ok
{14} tempest.api.network.test_ports.PortsIpV6TestJSON.test_show_port [0.149953s] ... ok
{18} tempest.api.network.test_floating_ips.FloatingIPTestJSON.test_create_list_show_update_delete_floating_ip [3.988153s] ... ok
{4} tempest.api.network.test_routers.RoutersIpV6Test.test_add_multiple_router_interfaces [20.990492s] ... ok
{19} tempest.scenario.test_dashboard_basic_ops.TestDashboardBasicOps.test_basic_scenario [22.522922s] ... ok
{4} tempest.api.network.test_routers.RoutersIpV6Test.test_add_remove_router_interface_with_port_id [3.614232s] ... ok
{4} tempest.api.network.test_routers.RoutersIpV6Test.test_add_remove_router_interface_with_subnet_id [5.353626s] ... ok
{36} tempest.api.compute.servers.test_server_addresses.ServerAddressesTestJSON.test_list_server_addresses [0.075603s] ... ok
{36} tempest.api.compute.servers.test_server_addresses.ServerAddressesTestJSON.test_list_server_addresses_by_network [0.134773s] ... ok
{7} tempest.api.volume.test_volumes_get.VolumesGetTest.test_volume_create_get_update_delete_from_image [19.859104s] ... ok
{4} tempest.api.network.test_routers.RoutersIpV6Test.test_create_show_list_update_delete_router [2.972312s] ... ok
{3} tempest.api.network.test_routers.RoutersTest.test_add_multiple_router_interfaces [33.584744s] ... ok
{4} setUpClass (tempest.api.object_storage.test_container_services.ContainerTest) ... SKIPPED: ContainerTest skipped as swift is not available
{3} tempest.api.network.test_routers.RoutersTest.test_add_remove_router_interface_with_port_id [4.121313s] ... ok
{39} tempest.api.compute.servers.test_create_server.ServersTestManualDisk.test_list_servers [0.151563s] ... ok
{39} tempest.api.compute.servers.test_create_server.ServersTestManualDisk.test_verify_server_details [0.000887s] ... ok
{1} tempest.api.volume.test_volumes_actions.VolumesActionsTest.test_attach_detach_volume_to_instance [27.576779s] ... ok
{3} tempest.api.network.test_routers.RoutersTest.test_add_remove_router_interface_with_subnet_id [3.607473s] ... ok
{38} tempest.api.compute.servers.test_create_server.ServersTestJSON.test_list_servers [0.180980s] ... ok
{38} tempest.api.compute.servers.test_create_server.ServersTestJSON.test_verify_server_details [0.000948s] ... ok
{3} tempest.api.network.test_routers.RoutersTest.test_create_show_list_update_delete_router [3.428370s] ... ok
{3} setUpClass (tempest.api.object_storage.test_account_services.AccountTest) ... SKIPPED: AccountTest skipped as swift is not available
{39} tempest.api.compute.test_versions.TestVersions.test_get_version_details [0.027541s] ... ok
{39} tempest.api.compute.test_versions.TestVersions.test_list_api_versions [0.009661s] ... ok
{37} tempest.api.compute.servers.test_create_server.ServersTestBootFromVolume.test_list_servers [0.138106s] ... ok
{37} tempest.api.compute.servers.test_create_server.ServersTestBootFromVolume.test_verify_server_details [0.000418s] ... ok
{0} tempest.api.compute.servers.test_attach_interfaces.AttachInterfacesUnderV243Test.test_add_remove_fixed_ip [44.809482s] ... ok
{38} tempest.api.volume.test_volumes_list.VolumesListTestJSON.test_volume_list [0.060105s] ... ok
{0} setUpClass (tempest.api.object_storage.test_container_quotas.ContainerQuotasTest) ... SKIPPED: ContainerQuotasTest skipped as swift is not available
{37} tempest.api.image.v2.test_versions.VersionsTest.test_list_versions [0.004959s] ... ok
{37} tempest.api.volume.test_versions.VersionsTest.test_list_versions [0.007435s] ... ok
{5} tempest.scenario.test_server_basic_ops.TestServerBasicOps.test_server_basic_ops [48.046029s] ... ok
{6} tempest.api.compute.servers.test_server_actions.ServerActionsTestJSON.test_reboot_server_hard [19.604068s] ... ok
{5} setUpClass (tempest.scenario.test_server_multinode.TestServerMultinode) ... SKIPPED: Less than 2 compute nodes, skipping multinode tests.
{2} tempest.scenario.test_network_basic_ops.TestNetworkBasicOps.test_network_basic_ops [94.658659s] ... ok

======
Totals
======
Ran: 97 tests in 97.2685 sec.
 - Passed: 91
 - Skipped: 6
 - Expected Fail: 0
 - Unexpected Success: 0
 - Failed: 0
Sum of execute time for each test: 559.3389 sec.

==============
Worker Balance
==============
 - Worker 0 (2 tests) => 0:00:46.852438
 - Worker 1 (2 tests) => 0:00:41.510254
 - Worker 2 (2 tests) => 0:01:37.268548
 - Worker 3 (5 tests) => 0:00:45.380440
 - Worker 4 (5 tests) => 0:00:33.679610
 - Worker 5 (2 tests) => 0:00:52.294605
 - Worker 6 (1 tests) => 0:00:19.604068
 - Worker 7 (2 tests) => 0:00:32.354134
 - Worker 8 (3 tests) => 0:00:18.957734
 - Worker 9 (3 tests) => 0:00:19.117547
 - Worker 10 (1 tests) => 0:00:19.142396
 - Worker 11 (3 tests) => 0:00:18.115462
 - Worker 12 (3 tests) => 0:00:17.541417
 - Worker 13 (5 tests) => 0:00:15.559713
 - Worker 14 (5 tests) => 0:00:16.122041
 - Worker 15 (6 tests) => 0:00:11.519430
 - Worker 16 (6 tests) => 0:00:11.776496
 - Worker 17 (1 tests) => 0:00:07.885479
 - Worker 18 (2 tests) => 0:00:07.184086
 - Worker 19 (1 tests) => 0:00:22.522922
 - Worker 20 (1 tests) => 0:00:02.286895
 - Worker 21 (2 tests) => 0:00:02.886837
 - Worker 22 (1 tests) => 0:00:02.309816
 - Worker 23 (3 tests) => 0:00:04.076889
 - Worker 24 (1 tests) => 0:00:06.812845
 - Worker 25 (2 tests) => 0:00:05.105248
 - Worker 26 (1 tests) => 0:00:01.246505
 - Worker 27 (1 tests) => 0:00:00.928502
 - Worker 28 (1 tests) => 0:00:00.480949
 - Worker 29 (1 tests) => 0:00:00.424229
 - Worker 30 (1 tests) => 0:00:00.399989
 - Worker 31 (1 tests) => 0:00:00.284531
 - Worker 32 (4 tests) => 0:00:00.482881
 - Worker 33 (1 tests) => 0:00:00.176415
 - Worker 34 (2 tests) => 0:00:00.479509
 - Worker 35 (1 tests) => 0:00:00.125011
 - Worker 36 (2 tests) => 0:00:00.218928
 - Worker 37 (4 tests) => 0:00:11.719752
 - Worker 38 (3 tests) => 0:00:14.444648
 - Worker 39 (4 tests) => 0:00:11.541808
___________________________________ summary ____________________________________
  smoke: commands succeeded
  congratulations :)
