smoke create: /opt/stack/tempest/.tox/tempest
smoke installdeps: -chttps://releases.openstack.org/constraints/upper/master, -r/opt/stack/tempest/requirements.txt
smoke develop-inst: /opt/stack/tempest
smoke installed: attrs==25.4.0,autopage==0.5.2,bcrypt==4.3.0,certifi==2026.1.4,cffi==2.0.0,charset-normalizer==3.4.4,cliff==4.13.1,cmd2==2.7.0,cryptography==43.0.3,debtcollector==3.0.0,defusedxml==0.7.1,fasteners==0.20,fixtures==4.2.6,idna==3.11,invoke==2.2.1,iso8601==2.1.0,jsonschema==4.25.1,jsonschema-specifications==2025.9.1,markdown-it-py==4.0.0,mdurl==0.1.2,msgpack==1.1.2,netaddr==1.3.0,oslo.concurrency==7.2.0,oslo.config==10.2.0,oslo.context==6.2.0,oslo.i18n==6.7.1,oslo.log==8.0.0,oslo.serialization==5.9.0,oslo.utils==9.2.0,packaging==25.0,paramiko==4.0.0,pbr==7.0.3,prettytable==3.16.0,psutil==7.1.1,pycparser==2.23,Pygments==2.19.2,PyNaCl==1.6.0,pyparsing==3.2.5,pyperclip==1.11.0,python-dateutil==2.9.0.post0,python-subunit==1.4.4,PyYAML==6.0.3,referencing==0.37.0,requests==2.32.5,rfc3986==2.0.0,rich==14.2.0,rich-argparse==1.7.1,rpds-py==0.28.0,setuptools==80.10.1,six==1.17.0,stestr==4.2.0,stevedore==5.6.0,-e git+https://opendev.org/openstack/tempest.git@8ccefd4bea48d6b38f7e16c50f97931b3fc2a5e2#egg=tempest,testscenarios==0.5.0,testtools==2.7.2,tomlkit==0.13.3,typing_extensions==4.15.0,tzdata==2025.2,urllib3==1.26.20,voluptuous==0.15.2,wcwidth==0.2.14,wrapt==2.0.0
smoke run-test-pre: PYTHONHASHSEED='3499842860'
smoke run-test: commands[0] | find . -type f -name '*.pyc' -delete
smoke run-test: commands[1] | tempest run --regex '\[.*\bsmoke\b.*\]'
{2} setUpClass (tempest.api.object_storage.test_account_services.AccountTest) ... SKIPPED: AccountTest skipped as swift is not available
{4} setUpClass (tempest.api.object_storage.test_account_quotas.AccountQuotasTest) ... SKIPPED: AccountQuotasTest skipped as swift is not available
{1} setUpClass (tempest.api.object_storage.test_object_services.ObjectTest) ... SKIPPED: ObjectTest skipped as swift is not available
{21} tempest.api.network.test_versions.NetworksApiDiscovery.test_api_version_resources [0.484722s] ... ok
{30} tempest.api.identity.v3.test_api_discovery.TestApiDiscovery.test_api_media_types [0.169556s] ... ok
{34} tempest.api.identity.v3.test_domains.DefaultDomainTestJSON.test_default_domain_exists [0.153088s] ... ok
{30} tempest.api.identity.v3.test_api_discovery.TestApiDiscovery.test_api_version_resources [0.071228s] ... ok
{30} tempest.api.identity.v3.test_api_discovery.TestApiDiscovery.test_api_version_statuses [0.109808s] ... ok
{35} tempest.api.compute.flavors.test_flavors.FlavorsV2TestJSON.test_get_flavor [0.581530s] ... ok
{30} tempest.api.identity.v3.test_api_discovery.TestApiDiscovery.test_list_api_versions [0.042314s] ... ok
{35} tempest.api.compute.flavors.test_flavors.FlavorsV2TestJSON.test_list_flavors [0.083181s] ... ok
{24} tempest.api.image.v2.test_images.BasicOperationsImagesTest.test_delete_image [1.128765s] ... ok
{33} tempest.api.identity.admin.v3.test_regions.RegionsTestJSON.test_create_region_with_specific_id [0.204113s] ... ok
{28} tempest.api.identity.admin.v3.test_services.ServicesTestJSON.test_create_update_get_service [0.624065s] ... ok
{32} tempest.api.identity.admin.v3.test_policies.PoliciesTestJSON.test_create_update_delete_policy [0.569440s] ... ok
{31} tempest.api.identity.admin.v3.test_credentials.CredentialsTestJSON.test_credentials_create_get_update_delete [0.632558s] ... ok
{21} tempest.api.network.test_versions.NetworksApiDiscovery.test_show_api_v2_details [1.838876s] ... ok
{27} tempest.api.identity.admin.v3.test_domains.DomainsTestJSON.test_create_update_delete_domain [0.754075s] ... ok
{26} tempest.api.identity.admin.v3.test_endpoints.EndPointsTestJSON.test_update_endpoint [0.896200s] ... ok
{29} tempest.api.identity.admin.v3.test_roles.RolesV3TestJSON.test_role_create_update_show_list [0.622473s] ... ok
{22} tempest.api.identity.admin.v3.test_trusts.TrustsV3TestJSON.test_get_trusts_all [2.267721s] ... ok
{24} tempest.api.image.v2.test_images.BasicOperationsImagesTest.test_register_upload_get_image_file [2.168612s] ... ok
{23} tempest.api.identity.admin.v3.test_groups.GroupsV3TestJSON.test_group_users_add_list_delete [2.397505s] ... ok
{24} tempest.api.image.v2.test_images.BasicOperationsImagesTest.test_update_image [0.699592s] ... ok
{19} tempest.api.network.test_subnetpools_extensions.SubnetPoolsTestJSON.test_create_list_show_update_delete_subnetpools [8.720097s] ... ok
{10} tempest.api.network.test_networks.BulkNetworkOpsTest.test_bulk_create_delete_network [9.212943s] ... ok
{9} tempest.api.network.test_networks.BulkNetworkOpsIpV6Test.test_bulk_create_delete_network [9.315323s] ... ok
{12} tempest.api.network.test_security_groups.SecGroupTest.test_create_list_update_show_delete_security_group [9.726068s] ... ok
{13} tempest.api.network.test_security_groups.SecGroupIPv6Test.test_create_list_update_show_delete_security_group [12.025580s] ... ok
{7} tempest.api.volume.test_volumes_get.VolumesGetTest.test_volume_create_get_update_delete [12.811575s] ... ok
{17} tempest.api.network.test_networks.NetworksIpV6Test.test_create_update_delete_network_subnet [10.446386s] ... ok
{16} tempest.api.network.test_networks.NetworksTest.test_create_update_delete_network_subnet [10.535162s] ... ok
{15} tempest.api.network.test_ports.PortsIpV6TestJSON.test_create_port_in_allowed_allocation_pools [11.288217s] ... ok
{20} tempest.api.compute.security_groups.test_security_group_rules.SecurityGroupRulesTestJSON.test_security_group_rules_create [1.727945s] ... ok
{17} tempest.api.network.test_networks.NetworksIpV6Test.test_external_network_visibility [1.142315s] ... ok
{17} tempest.api.network.test_networks.NetworksIpV6Test.test_list_networks [0.214321s] ... ok
{17} tempest.api.network.test_networks.NetworksIpV6Test.test_list_subnets [0.214970s] ... ok
{16} tempest.api.network.test_networks.NetworksTest.test_external_network_visibility [1.271892s] ... ok
{10} tempest.api.network.test_networks.BulkNetworkOpsTest.test_bulk_create_delete_port [6.672744s] ... ok
{14} tempest.api.network.test_ports.PortsTestJSON.test_create_port_in_allowed_allocation_pools [11.750073s] ... ok
{17} tempest.api.network.test_networks.NetworksIpV6Test.test_show_network [0.159163s] ... ok
{9} tempest.api.network.test_networks.BulkNetworkOpsIpV6Test.test_bulk_create_delete_port [6.616008s] ... ok
{16} tempest.api.network.test_networks.NetworksTest.test_list_networks [0.237156s] ... ok
{17} tempest.api.network.test_networks.NetworksIpV6Test.test_show_subnet [0.147090s] ... ok
{16} tempest.api.network.test_networks.NetworksTest.test_list_subnets [0.205209s] ... ok
{16} tempest.api.network.test_networks.NetworksTest.test_show_network [0.126161s] ... ok
{16} tempest.api.network.test_networks.NetworksTest.test_show_subnet [0.118134s] ... ok
{18} tempest.api.network.test_floating_ips.FloatingIPTestJSON.test_create_floating_ip_specifying_a_fixed_ip_address [3.019130s] ... ok
{20} tempest.api.compute.security_groups.test_security_group_rules.SecurityGroupRulesTestJSON.test_security_group_rules_list [2.201517s] ... ok
{15} tempest.api.network.test_ports.PortsIpV6TestJSON.test_create_port_with_no_securitygroups [2.819363s] ... ok
{25} tempest.api.compute.security_groups.test_security_groups.SecurityGroupsTestJSON.test_security_groups_create_list_delete [5.204227s] ... ok
{13} tempest.api.network.test_security_groups.SecGroupIPv6Test.test_create_show_delete_security_group_rule [5.434325s] ... ok
{12} tempest.api.network.test_security_groups.SecGroupTest.test_create_show_delete_security_group_rule [8.256620s] ... ok
{13} tempest.api.network.test_security_groups.SecGroupIPv6Test.test_list_security_groups [0.075539s] ... ok
{12} tempest.api.network.test_security_groups.SecGroupTest.test_list_security_groups [0.110608s] ... ok
{15} tempest.api.network.test_ports.PortsIpV6TestJSON.test_create_update_delete_port [1.113192s] ... ok
{11} tempest.api.network.test_extensions.ExtensionsTestJSON.test_list_show_extensions [18.643326s] ... ok
{15} tempest.api.network.test_ports.PortsIpV6TestJSON.test_list_ports [0.125293s] ... ok
{15} tempest.api.network.test_ports.PortsIpV6TestJSON.test_show_port [0.065622s] ... ok
{14} tempest.api.network.test_ports.PortsTestJSON.test_create_port_with_no_securitygroups [3.005662s] ... ok
{10} tempest.api.network.test_networks.BulkNetworkOpsTest.test_bulk_create_delete_subnet [3.663726s] ... ok
{9} tempest.api.network.test_networks.BulkNetworkOpsIpV6Test.test_bulk_create_delete_subnet [3.513763s] ... ok
{14} tempest.api.network.test_ports.PortsTestJSON.test_create_update_delete_port [0.978523s] ... ok
{18} tempest.api.network.test_floating_ips.FloatingIPTestJSON.test_create_list_show_update_delete_floating_ip [3.331468s] ... ok
{14} tempest.api.network.test_ports.PortsTestJSON.test_list_ports [0.128260s] ... ok
{14} tempest.api.network.test_ports.PortsTestJSON.test_show_port [0.046487s] ... ok
{8} tempest.scenario.test_dashboard_basic_ops.TestDashboardBasicOps.test_basic_scenario [22.744677s] ... ok
{5} tempest.api.network.test_routers.RoutersIpV6Test.test_add_multiple_router_interfaces [28.876425s] ... ok
{3} tempest.api.network.test_routers.RoutersTest.test_add_multiple_router_interfaces [30.435048s] ... ok
{5} tempest.api.network.test_routers.RoutersIpV6Test.test_add_remove_router_interface_with_port_id [3.530039s] ... ok
{3} tempest.api.network.test_routers.RoutersTest.test_add_remove_router_interface_with_port_id [4.598977s] ... ok
{37} tempest.api.compute.servers.test_server_addresses.ServerAddressesTestJSON.test_list_server_addresses [0.054952s] ... ok
{37} tempest.api.compute.servers.test_server_addresses.ServerAddressesTestJSON.test_list_server_addresses_by_network [0.084222s] ... ok
{5} tempest.api.network.test_routers.RoutersIpV6Test.test_add_remove_router_interface_with_subnet_id [4.477996s] ... ok
{7} tempest.api.volume.test_volumes_get.VolumesGetTest.test_volume_create_get_update_delete_from_image [24.307945s] ... ok
{3} tempest.api.network.test_routers.RoutersTest.test_add_remove_router_interface_with_subnet_id [4.000926s] ... ok
{5} tempest.api.network.test_routers.RoutersIpV6Test.test_create_show_list_update_delete_router [3.659087s] ... ok
{38} tempest.api.compute.servers.test_create_server.ServersTestJSON.test_list_servers [0.157655s] ... ok
{38} tempest.api.compute.servers.test_create_server.ServersTestJSON.test_verify_server_details [0.000376s] ... ok
{5} setUpClass (tempest.scenario.test_server_multinode.TestServerMultinode) ... SKIPPED: Less than 2 compute nodes, skipping multinode tests.
{3} tempest.api.network.test_routers.RoutersTest.test_create_show_list_update_delete_router [2.570145s] ... ok
{1} tempest.api.volume.test_volumes_actions.VolumesActionsTest.test_attach_detach_volume_to_instance [28.364865s] ... ok
{3} setUpClass (tempest.api.object_storage.test_container_services.ContainerTest) ... SKIPPED: ContainerTest skipped as swift is not available
{36} tempest.api.compute.servers.test_create_server.ServersTestManualDisk.test_list_servers [0.146190s] ... ok
{36} tempest.api.compute.servers.test_create_server.ServersTestManualDisk.test_verify_server_details [0.000569s] ... ok
{39} tempest.api.compute.servers.test_create_server.ServersTestBootFromVolume.test_list_servers [0.139862s] ... ok
{39} tempest.api.compute.servers.test_create_server.ServersTestBootFromVolume.test_verify_server_details [0.000943s] ... ok
{38} tempest.api.volume.test_versions.VersionsTest.test_list_versions [0.008128s] ... ok
{38} tempest.api.volume.test_volumes_list.VolumesListTestJSON.test_volume_list [0.049403s] ... ok
{0} tempest.api.compute.servers.test_attach_interfaces.AttachInterfacesUnderV243Test.test_add_remove_fixed_ip [51.544851s] ... ok
{39} tempest.api.compute.test_versions.TestVersions.test_get_version_details [0.027684s] ... ok
{39} tempest.api.compute.test_versions.TestVersions.test_list_api_versions [0.008496s] ... ok
{0} setUpClass (tempest.api.object_storage.test_container_quotas.ContainerQuotasTest) ... SKIPPED: ContainerQuotasTest skipped as swift is not available
{39} tempest.api.image.v2.test_versions.VersionsTest.test_list_versions [0.004611s] ... ok
{4} tempest.scenario.test_server_basic_ops.TestServerBasicOps.test_server_basic_ops [48.785593s] ... ok
{6} tempest.api.compute.servers.test_server_actions.ServerActionsTestJSON.test_reboot_server_hard [21.988974s] ... ok
{2} tempest.scenario.test_network_basic_ops.TestNetworkBasicOps.test_network_basic_ops [90.883461s] ... ok

======
Totals
======
Ran: 97 tests in 93.6319 sec.
 - Passed: 91
 - Skipped: 6
 - Expected Fail: 0
 - Unexpected Success: 0
 - Failed: 0
Sum of execute time for each test: 574.3727 sec.

==============
Worker Balance
==============
 - Worker 0 (2 tests) => 0:00:53.730603
 - Worker 1 (2 tests) => 0:00:43.065932
 - Worker 2 (2 tests) => 0:01:33.631920
 - Worker 3 (5 tests) => 0:00:42.274311
 - Worker 4 (2 tests) => 0:01:09.526383
 - Worker 5 (5 tests) => 0:00:41.243847
 - Worker 6 (1 tests) => 0:00:21.988974
 - Worker 7 (2 tests) => 0:00:37.126343
 - Worker 8 (1 tests) => 0:00:22.744677
 - Worker 9 (3 tests) => 0:00:19.452738
 - Worker 10 (3 tests) => 0:00:19.557748
 - Worker 11 (1 tests) => 0:00:18.643326
 - Worker 12 (3 tests) => 0:00:18.103663
 - Worker 13 (3 tests) => 0:00:17.545293
 - Worker 14 (5 tests) => 0:00:15.919822
 - Worker 15 (5 tests) => 0:00:15.419647
 - Worker 16 (6 tests) => 0:00:12.503030
 - Worker 17 (6 tests) => 0:00:12.334676
 - Worker 18 (2 tests) => 0:00:06.358795
 - Worker 19 (1 tests) => 0:00:08.720097
 - Worker 20 (2 tests) => 0:00:03.936080
 - Worker 21 (2 tests) => 0:00:02.329378
 - Worker 22 (1 tests) => 0:00:02.267721
 - Worker 23 (1 tests) => 0:00:02.397505
 - Worker 24 (3 tests) => 0:00:04.006533
 - Worker 25 (1 tests) => 0:00:05.204227
 - Worker 26 (1 tests) => 0:00:00.896200
 - Worker 27 (1 tests) => 0:00:00.754075
 - Worker 28 (1 tests) => 0:00:00.624065
 - Worker 29 (1 tests) => 0:00:00.622473
 - Worker 30 (4 tests) => 0:00:00.400529
 - Worker 31 (1 tests) => 0:00:00.632558
 - Worker 32 (1 tests) => 0:00:00.569440
 - Worker 33 (1 tests) => 0:00:00.204113
 - Worker 34 (1 tests) => 0:00:00.153088
 - Worker 35 (2 tests) => 0:00:00.673591
 - Worker 36 (2 tests) => 0:00:00.152495
 - Worker 37 (2 tests) => 0:00:00.147376
 - Worker 38 (4 tests) => 0:00:15.585661
 - Worker 39 (5 tests) => 0:00:13.280584
___________________________________ summary ____________________________________
  smoke: commands succeeded
  congratulations :)
