smoke create: /opt/stack/tempest/.tox/tempest
smoke installdeps: -chttps://releases.openstack.org/constraints/upper/master, -r/opt/stack/tempest/requirements.txt
smoke develop-inst: /opt/stack/tempest
smoke installed: attrs==25.4.0,autopage==0.5.2,bcrypt==4.3.0,certifi==2026.1.4,cffi==2.0.0,charset-normalizer==3.4.4,cliff==4.13.0,cmd2==2.7.0,cryptography==43.0.3,debtcollector==3.0.0,defusedxml==0.7.1,fasteners==0.20,fixtures==4.2.6,idna==3.11,invoke==2.2.1,iso8601==2.1.0,jsonschema==4.25.1,jsonschema-specifications==2025.9.1,markdown-it-py==4.0.0,mdurl==0.1.2,msgpack==1.1.2,netaddr==1.3.0,oslo.concurrency==7.2.0,oslo.config==10.1.0,oslo.context==6.2.0,oslo.i18n==6.7.1,oslo.log==7.2.1,oslo.serialization==5.9.0,oslo.utils==9.2.0,packaging==25.0,paramiko==4.0.0,pbr==7.0.3,prettytable==3.16.0,psutil==7.1.1,pycparser==2.23,Pygments==2.19.2,PyNaCl==1.6.0,pyparsing==3.2.5,pyperclip==1.11.0,python-dateutil==2.9.0.post0,python-subunit==1.4.4,PyYAML==6.0.3,referencing==0.37.0,requests==2.32.5,rfc3986==2.0.0,rich==14.2.0,rich-argparse==1.7.1,rpds-py==0.28.0,setuptools==80.9.0,six==1.17.0,stestr==4.2.0,stevedore==5.6.0,-e git+https://opendev.org/openstack/tempest.git@8ccefd4bea48d6b38f7e16c50f97931b3fc2a5e2#egg=tempest,testscenarios==0.5.0,testtools==2.7.2,tomlkit==0.13.3,typing_extensions==4.15.0,tzdata==2025.2,urllib3==1.26.20,voluptuous==0.15.2,wcwidth==0.2.14,wrapt==2.0.0
smoke run-test-pre: PYTHONHASHSEED='3879037840'
smoke run-test: commands[0] | find . -type f -name '*.pyc' -delete
smoke run-test: commands[1] | tempest run --regex '\[.*\bsmoke\b.*\]'
{1} setUpClass (tempest.api.object_storage.test_account_services.AccountTest) ... SKIPPED: AccountTest skipped as swift is not available
{3} setUpClass (tempest.api.object_storage.test_container_quotas.ContainerQuotasTest) ... SKIPPED: ContainerQuotasTest skipped as swift is not available
{36} tempest.api.identity.v3.test_domains.DefaultDomainTestJSON.test_default_domain_exists [0.165603s] ... ok
{32} tempest.api.identity.v3.test_api_discovery.TestApiDiscovery.test_api_media_types [0.133752s] ... ok
{34} tempest.api.compute.flavors.test_flavors.FlavorsV2TestJSON.test_get_flavor [0.423983s] ... ok
{32} tempest.api.identity.v3.test_api_discovery.TestApiDiscovery.test_api_version_resources [0.166413s] ... ok
{34} tempest.api.compute.flavors.test_flavors.FlavorsV2TestJSON.test_list_flavors [0.088792s] ... ok
{32} tempest.api.identity.v3.test_api_discovery.TestApiDiscovery.test_api_version_statuses [0.080195s] ... ok
{32} tempest.api.identity.v3.test_api_discovery.TestApiDiscovery.test_list_api_versions [0.029558s] ... ok
{21} tempest.api.image.v2.test_images.BasicOperationsImagesTest.test_delete_image [1.167726s] ... ok
{28} tempest.api.identity.admin.v3.test_services.ServicesTestJSON.test_create_update_get_service [0.525864s] ... ok
{30} tempest.api.identity.admin.v3.test_policies.PoliciesTestJSON.test_create_update_delete_policy [0.553214s] ... ok
{20} tempest.api.network.test_versions.NetworksApiDiscovery.test_api_version_resources [1.317296s] ... ok
{33} tempest.api.identity.admin.v3.test_regions.RegionsTestJSON.test_create_region_with_specific_id [0.307074s] ... ok
{29} tempest.api.identity.admin.v3.test_credentials.CredentialsTestJSON.test_credentials_create_get_update_delete [0.436818s] ... ok
{26} tempest.api.identity.admin.v3.test_domains.DomainsTestJSON.test_create_update_delete_domain [0.952713s] ... ok
{31} tempest.api.identity.admin.v3.test_roles.RolesV3TestJSON.test_role_create_update_show_list [0.431777s] ... ok
{27} tempest.api.identity.admin.v3.test_endpoints.EndPointsTestJSON.test_update_endpoint [1.006178s] ... ok
{21} tempest.api.image.v2.test_images.BasicOperationsImagesTest.test_register_upload_get_image_file [1.910219s] ... ok
{23} tempest.api.identity.admin.v3.test_trusts.TrustsV3TestJSON.test_get_trusts_all [2.212983s] ... ok
{20} tempest.api.network.test_versions.NetworksApiDiscovery.test_show_api_v2_details [1.824865s] ... ok
{22} tempest.api.identity.admin.v3.test_groups.GroupsV3TestJSON.test_group_users_add_list_delete [2.444718s] ... ok
{21} tempest.api.image.v2.test_images.BasicOperationsImagesTest.test_update_image [0.726352s] ... ok
{17} tempest.api.network.test_subnetpools_extensions.SubnetPoolsTestJSON.test_create_list_show_update_delete_subnetpools [8.150262s] ... ok
{8} tempest.api.network.test_networks.BulkNetworkOpsTest.test_bulk_create_delete_network [9.073731s] ... ok
{9} tempest.api.network.test_networks.BulkNetworkOpsIpV6Test.test_bulk_create_delete_network [10.899139s] ... ok
{11} tempest.api.network.test_security_groups.SecGroupIPv6Test.test_create_list_update_show_delete_security_group [11.465556s] ... ok
{12} tempest.api.network.test_security_groups.SecGroupTest.test_create_list_update_show_delete_security_group [11.708784s] ... ok
{4} tempest.api.volume.test_volumes_get.VolumesGetTest.test_volume_create_get_update_delete [12.468052s] ... ok
{15} tempest.api.network.test_networks.NetworksTest.test_create_update_delete_network_subnet [10.231569s] ... ok
{16} tempest.api.network.test_networks.NetworksIpV6Test.test_create_update_delete_network_subnet [10.268238s] ... ok
{14} tempest.api.network.test_ports.PortsIpV6TestJSON.test_create_port_in_allowed_allocation_pools [11.269268s] ... ok
{24} tempest.api.compute.security_groups.test_security_group_rules.SecurityGroupRulesTestJSON.test_security_group_rules_create [1.403239s] ... ok
{15} tempest.api.network.test_networks.NetworksTest.test_external_network_visibility [1.156905s] ... ok
{13} tempest.api.network.test_ports.PortsTestJSON.test_create_port_in_allowed_allocation_pools [11.918839s] ... ok
{15} tempest.api.network.test_networks.NetworksTest.test_list_networks [0.631028s] ... ok
{16} tempest.api.network.test_networks.NetworksIpV6Test.test_external_network_visibility [1.432839s] ... ok
{15} tempest.api.network.test_networks.NetworksTest.test_list_subnets [0.376034s] ... ok
{16} tempest.api.network.test_networks.NetworksIpV6Test.test_list_networks [0.305672s] ... ok
{8} tempest.api.network.test_networks.BulkNetworkOpsTest.test_bulk_create_delete_port [6.971748s] ... ok
{15} tempest.api.network.test_networks.NetworksTest.test_show_network [0.317650s] ... ok
{16} tempest.api.network.test_networks.NetworksIpV6Test.test_list_subnets [0.202068s] ... ok
{15} tempest.api.network.test_networks.NetworksTest.test_show_subnet [0.141761s] ... ok
{16} tempest.api.network.test_networks.NetworksIpV6Test.test_show_network [0.222876s] ... ok
{9} tempest.api.network.test_networks.BulkNetworkOpsIpV6Test.test_bulk_create_delete_port [5.740917s] ... ok
{16} tempest.api.network.test_networks.NetworksIpV6Test.test_show_subnet [0.238243s] ... ok
{18} tempest.api.network.test_floating_ips.FloatingIPTestJSON.test_create_floating_ip_specifying_a_fixed_ip_address [2.819947s] ... ok
{24} tempest.api.compute.security_groups.test_security_group_rules.SecurityGroupRulesTestJSON.test_security_group_rules_list [2.926183s] ... ok
{25} tempest.api.compute.security_groups.test_security_groups.SecurityGroupsTestJSON.test_security_groups_create_list_delete [5.874332s] ... ok
{14} tempest.api.network.test_ports.PortsIpV6TestJSON.test_create_port_with_no_securitygroups [3.687069s] ... ok
{11} tempest.api.network.test_security_groups.SecGroupIPv6Test.test_create_show_delete_security_group_rule [6.854292s] ... ok
{12} tempest.api.network.test_security_groups.SecGroupTest.test_create_show_delete_security_group_rule [6.607256s] ... ok
{11} tempest.api.network.test_security_groups.SecGroupIPv6Test.test_list_security_groups [0.063999s] ... ok
{12} tempest.api.network.test_security_groups.SecGroupTest.test_list_security_groups [0.045894s] ... ok
{10} tempest.api.network.test_extensions.ExtensionsTestJSON.test_list_show_extensions [18.717291s] ... ok
{13} tempest.api.network.test_ports.PortsTestJSON.test_create_port_with_no_securitygroups [3.918489s] ... ok
{8} tempest.api.network.test_networks.BulkNetworkOpsTest.test_bulk_create_delete_subnet [3.550973s] ... ok
{14} tempest.api.network.test_ports.PortsIpV6TestJSON.test_create_update_delete_port [1.493440s] ... ok
{14} tempest.api.network.test_ports.PortsIpV6TestJSON.test_list_ports [0.046364s] ... ok
{14} tempest.api.network.test_ports.PortsIpV6TestJSON.test_show_port [0.067510s] ... ok
{9} tempest.api.network.test_networks.BulkNetworkOpsIpV6Test.test_bulk_create_delete_subnet [3.264581s] ... ok
{13} tempest.api.network.test_ports.PortsTestJSON.test_create_update_delete_port [0.911870s] ... ok
{13} tempest.api.network.test_ports.PortsTestJSON.test_list_ports [0.045112s] ... ok
{13} tempest.api.network.test_ports.PortsTestJSON.test_show_port [0.071407s] ... ok
{2} tempest.api.network.test_routers.RoutersTest.test_add_multiple_router_interfaces [22.164674s] ... ok
{18} tempest.api.network.test_floating_ips.FloatingIPTestJSON.test_create_list_show_update_delete_floating_ip [5.090096s] ... ok
{5} tempest.api.network.test_routers.RoutersIpV6Test.test_add_multiple_router_interfaces [22.252228s] ... ok
{19} tempest.scenario.test_dashboard_basic_ops.TestDashboardBasicOps.test_basic_scenario [22.613604s] ... ok
{5} tempest.api.network.test_routers.RoutersIpV6Test.test_add_remove_router_interface_with_port_id [3.688789s] ... ok
{2} tempest.api.network.test_routers.RoutersTest.test_add_remove_router_interface_with_port_id [4.119988s] ... ok
{5} tempest.api.network.test_routers.RoutersIpV6Test.test_add_remove_router_interface_with_subnet_id [3.046805s] ... ok
{2} tempest.api.network.test_routers.RoutersTest.test_add_remove_router_interface_with_subnet_id [4.871485s] ... ok
{5} tempest.api.network.test_routers.RoutersIpV6Test.test_create_show_list_update_delete_router [2.603551s] ... ok
{5} setUpClass (tempest.api.object_storage.test_container_services.ContainerTest) ... SKIPPED: ContainerTest skipped as swift is not available
{35} tempest.api.compute.servers.test_server_addresses.ServerAddressesTestJSON.test_list_server_addresses [0.052445s] ... ok
{35} tempest.api.compute.servers.test_server_addresses.ServerAddressesTestJSON.test_list_server_addresses_by_network [0.124489s] ... ok
{4} tempest.api.volume.test_volumes_get.VolumesGetTest.test_volume_create_get_update_delete_from_image [21.893344s] ... ok
{2} tempest.api.network.test_routers.RoutersTest.test_create_show_list_update_delete_router [3.778289s] ... ok
{4} setUpClass (tempest.scenario.test_server_multinode.TestServerMultinode) ... SKIPPED: Less than 2 compute nodes, skipping multinode tests.
{2} setUpClass (tempest.api.object_storage.test_account_quotas.AccountQuotasTest) ... SKIPPED: AccountQuotasTest skipped as swift is not available
{39} tempest.api.compute.servers.test_create_server.ServersTestManualDisk.test_list_servers [0.141401s] ... ok
{39} tempest.api.compute.servers.test_create_server.ServersTestManualDisk.test_verify_server_details [0.000430s] ... ok
{37} tempest.api.compute.servers.test_create_server.ServersTestJSON.test_list_servers [0.147069s] ... ok
{37} tempest.api.compute.servers.test_create_server.ServersTestJSON.test_verify_server_details [0.000404s] ... ok
{7} tempest.api.volume.test_volumes_actions.VolumesActionsTest.test_attach_detach_volume_to_instance [31.497695s] ... ok
{39} tempest.api.compute.test_versions.TestVersions.test_get_version_details [0.027944s] ... ok
{39} tempest.api.compute.test_versions.TestVersions.test_list_api_versions [0.009213s] ... ok
{39} tempest.api.image.v2.test_versions.VersionsTest.test_list_versions [0.004838s] ... ok
{38} tempest.api.compute.servers.test_create_server.ServersTestBootFromVolume.test_list_servers [0.152149s] ... ok
{38} tempest.api.compute.servers.test_create_server.ServersTestBootFromVolume.test_verify_server_details [0.000441s] ... ok
{0} tempest.api.compute.servers.test_attach_interfaces.AttachInterfacesUnderV243Test.test_add_remove_fixed_ip [47.370129s] ... ok
{0} setUpClass (tempest.api.object_storage.test_object_services.ObjectTest) ... SKIPPED: ObjectTest skipped as swift is not available
{38} tempest.api.volume.test_versions.VersionsTest.test_list_versions [0.008105s] ... ok
{3} tempest.scenario.test_server_basic_ops.TestServerBasicOps.test_server_basic_ops [48.596495s] ... ok
{38} tempest.api.volume.test_volumes_list.VolumesListTestJSON.test_volume_list [0.068448s] ... ok
{6} tempest.api.compute.servers.test_server_actions.ServerActionsTestJSON.test_reboot_server_hard [22.940517s] ... ok
{1} tempest.scenario.test_network_basic_ops.TestNetworkBasicOps.test_network_basic_ops [93.716956s] ... ok

======
Totals
======
Ran: 97 tests in 96.4133 sec.
 - Passed: 91
 - Skipped: 6
 - Expected Fail: 0
 - Unexpected Success: 0
 - Failed: 0
Sum of execute time for each test: 565.4485 sec.

==============
Worker Balance
==============
 - Worker 0 (2 tests) => 0:00:49.571708
 - Worker 1 (2 tests) => 0:01:36.413298
 - Worker 2 (5 tests) => 0:00:35.721887
 - Worker 3 (2 tests) => 0:01:08.445206
 - Worker 4 (3 tests) => 0:00:35.086117
 - Worker 5 (5 tests) => 0:00:32.306142
 - Worker 6 (1 tests) => 0:00:22.940517
 - Worker 7 (1 tests) => 0:00:31.497695
 - Worker 8 (3 tests) => 0:00:19.603035
 - Worker 9 (3 tests) => 0:00:19.912251
 - Worker 10 (1 tests) => 0:00:18.717291
 - Worker 11 (3 tests) => 0:00:18.393315
 - Worker 12 (3 tests) => 0:00:18.369666
 - Worker 13 (5 tests) => 0:00:16.876661
 - Worker 14 (5 tests) => 0:00:16.575735
 - Worker 15 (6 tests) => 0:00:12.864602
 - Worker 16 (6 tests) => 0:00:12.687609
 - Worker 17 (1 tests) => 0:00:08.150262
 - Worker 18 (2 tests) => 0:00:07.919391
 - Worker 19 (1 tests) => 0:00:22.613604
 - Worker 20 (2 tests) => 0:00:03.149088
 - Worker 21 (3 tests) => 0:00:03.813319
 - Worker 22 (1 tests) => 0:00:02.444718
 - Worker 23 (1 tests) => 0:00:02.212983
 - Worker 24 (2 tests) => 0:00:04.336030
 - Worker 25 (1 tests) => 0:00:05.874332
 - Worker 26 (1 tests) => 0:00:00.952713
 - Worker 27 (1 tests) => 0:00:01.006178
 - Worker 28 (1 tests) => 0:00:00.525864
 - Worker 29 (1 tests) => 0:00:00.436818
 - Worker 30 (1 tests) => 0:00:00.553214
 - Worker 31 (1 tests) => 0:00:00.431777
 - Worker 32 (4 tests) => 0:00:00.420880
 - Worker 33 (1 tests) => 0:00:00.307074
 - Worker 34 (2 tests) => 0:00:00.521022
 - Worker 35 (2 tests) => 0:00:00.182347
 - Worker 36 (1 tests) => 0:00:00.165603
 - Worker 37 (2 tests) => 0:00:00.154012
 - Worker 38 (4 tests) => 0:00:17.037134
 - Worker 39 (5 tests) => 0:00:11.183944
___________________________________ summary ____________________________________
  smoke: commands succeeded
  congratulations :)
