smoke create: /opt/stack/tempest/.tox/tempest
smoke installdeps: -chttps://releases.openstack.org/constraints/upper/master, -r/opt/stack/tempest/requirements.txt
smoke develop-inst: /opt/stack/tempest
smoke installed: attrs==25.4.0,autopage==0.5.2,bcrypt==4.3.0,certifi==2026.1.4,cffi==2.0.0,charset-normalizer==3.4.4,cliff==4.13.1,cmd2==2.7.0,cryptography==43.0.3,debtcollector==3.0.0,defusedxml==0.7.1,fasteners==0.20,fixtures==4.2.6,idna==3.11,invoke==2.2.1,iso8601==2.1.0,jsonschema==4.25.1,jsonschema-specifications==2025.9.1,markdown-it-py==4.0.0,mdurl==0.1.2,msgpack==1.1.2,netaddr==1.3.0,oslo.concurrency==7.2.0,oslo.config==10.2.0,oslo.context==6.2.0,oslo.i18n==6.7.1,oslo.log==8.0.0,oslo.serialization==5.9.0,oslo.utils==9.2.0,packaging==25.0,paramiko==4.0.0,pbr==7.0.3,prettytable==3.16.0,psutil==7.1.1,pycparser==2.23,Pygments==2.19.2,PyNaCl==1.6.0,pyparsing==3.2.5,pyperclip==1.11.0,python-dateutil==2.9.0.post0,python-subunit==1.4.4,PyYAML==6.0.3,referencing==0.37.0,requests==2.32.5,rfc3986==2.0.0,rich==14.2.0,rich-argparse==1.7.1,rpds-py==0.28.0,setuptools==80.10.1,six==1.17.0,stestr==4.2.0,stevedore==5.6.0,-e git+https://opendev.org/openstack/tempest.git@8ccefd4bea48d6b38f7e16c50f97931b3fc2a5e2#egg=tempest,testscenarios==0.5.0,testtools==2.7.2,tomlkit==0.13.3,typing_extensions==4.15.0,tzdata==2025.2,urllib3==1.26.20,voluptuous==0.15.2,wcwidth==0.2.14,wrapt==2.0.0
smoke run-test-pre: PYTHONHASHSEED='3130918671'
smoke run-test: commands[0] | find . -type f -name '*.pyc' -delete
smoke run-test: commands[1] | tempest run --regex '\[.*\bsmoke\b.*\]'
{3} setUpClass (tempest.api.object_storage.test_container_services.ContainerTest) ... SKIPPED: ContainerTest skipped as swift is not available
{2} setUpClass (tempest.api.object_storage.test_account_services.AccountTest) ... SKIPPED: AccountTest skipped as swift is not available
{28} tempest.api.identity.v3.test_api_discovery.TestApiDiscovery.test_api_media_types [0.229788s] ... ok
{28} tempest.api.identity.v3.test_api_discovery.TestApiDiscovery.test_api_version_resources [0.169341s] ... ok
{28} tempest.api.identity.v3.test_api_discovery.TestApiDiscovery.test_api_version_statuses [0.079678s] ... ok
{37} tempest.api.identity.v3.test_domains.DefaultDomainTestJSON.test_default_domain_exists [0.179214s] ... ok
{28} tempest.api.identity.v3.test_api_discovery.TestApiDiscovery.test_list_api_versions [0.011594s] ... ok
{36} tempest.api.compute.flavors.test_flavors.FlavorsV2TestJSON.test_get_flavor [0.400733s] ... ok
{36} tempest.api.compute.flavors.test_flavors.FlavorsV2TestJSON.test_list_flavors [0.075096s] ... ok
{24} tempest.api.image.v2.test_images.BasicOperationsImagesTest.test_delete_image [1.072313s] ... ok
{33} tempest.api.identity.admin.v3.test_policies.PoliciesTestJSON.test_create_update_delete_policy [0.335007s] ... ok
{30} tempest.api.identity.admin.v3.test_regions.RegionsTestJSON.test_create_region_with_specific_id [0.192477s] ... ok
{21} tempest.api.network.test_versions.NetworksApiDiscovery.test_api_version_resources [1.516453s] ... ok
{32} tempest.api.identity.admin.v3.test_services.ServicesTestJSON.test_create_update_get_service [0.541137s] ... ok
{29} tempest.api.identity.admin.v3.test_credentials.CredentialsTestJSON.test_credentials_create_get_update_delete [0.441970s] ... ok
{27} tempest.api.identity.admin.v3.test_domains.DomainsTestJSON.test_create_update_delete_domain [0.891936s] ... ok
{31} tempest.api.identity.admin.v3.test_roles.RolesV3TestJSON.test_role_create_update_show_list [0.508985s] ... ok
{26} tempest.api.identity.admin.v3.test_endpoints.EndPointsTestJSON.test_update_endpoint [1.029370s] ... ok
{21} tempest.api.network.test_versions.NetworksApiDiscovery.test_show_api_v2_details [1.224705s] ... ok
{24} tempest.api.image.v2.test_images.BasicOperationsImagesTest.test_register_upload_get_image_file [1.890257s] ... ok
{22} tempest.api.identity.admin.v3.test_groups.GroupsV3TestJSON.test_group_users_add_list_delete [2.160909s] ... ok
{23} tempest.api.identity.admin.v3.test_trusts.TrustsV3TestJSON.test_get_trusts_all [2.336338s] ... ok
{24} tempest.api.image.v2.test_images.BasicOperationsImagesTest.test_update_image [0.744668s] ... ok
{18} tempest.api.network.test_subnetpools_extensions.SubnetPoolsTestJSON.test_create_list_show_update_delete_subnetpools [7.504554s] ... ok
{9} tempest.api.network.test_networks.BulkNetworkOpsTest.test_bulk_create_delete_network [7.846896s] ... ok
{10} tempest.api.network.test_networks.BulkNetworkOpsIpV6Test.test_bulk_create_delete_network [9.289935s] ... ok
{13} tempest.api.network.test_security_groups.SecGroupTest.test_create_list_update_show_delete_security_group [10.421706s] ... ok
{12} tempest.api.network.test_security_groups.SecGroupIPv6Test.test_create_list_update_show_delete_security_group [10.851208s] ... ok
{7} tempest.api.volume.test_volumes_get.VolumesGetTest.test_volume_create_get_update_delete [12.682502s] ... ok
{20} tempest.api.compute.security_groups.test_security_group_rules.SecurityGroupRulesTestJSON.test_security_group_rules_create [3.488823s] ... ok
{16} tempest.api.network.test_networks.NetworksTest.test_create_update_delete_network_subnet [9.891496s] ... ok
{17} tempest.api.network.test_networks.NetworksIpV6Test.test_create_update_delete_network_subnet [9.721026s] ... ok
{14} tempest.api.network.test_ports.PortsIpV6TestJSON.test_create_port_in_allowed_allocation_pools [10.422317s] ... ok
{15} tempest.api.network.test_ports.PortsTestJSON.test_create_port_in_allowed_allocation_pools [11.169071s] ... ok
{16} tempest.api.network.test_networks.NetworksTest.test_external_network_visibility [1.153785s] ... ok
{9} tempest.api.network.test_networks.BulkNetworkOpsTest.test_bulk_create_delete_port [7.318856s] ... ok
{17} tempest.api.network.test_networks.NetworksIpV6Test.test_external_network_visibility [1.022810s] ... ok
{16} tempest.api.network.test_networks.NetworksTest.test_list_networks [0.324425s] ... ok
{17} tempest.api.network.test_networks.NetworksIpV6Test.test_list_networks [0.325820s] ... ok
{16} tempest.api.network.test_networks.NetworksTest.test_list_subnets [0.316053s] ... ok
{17} tempest.api.network.test_networks.NetworksIpV6Test.test_list_subnets [0.163687s] ... ok
{10} tempest.api.network.test_networks.BulkNetworkOpsIpV6Test.test_bulk_create_delete_port [6.460730s] ... ok
{16} tempest.api.network.test_networks.NetworksTest.test_show_network [0.175438s] ... ok
{17} tempest.api.network.test_networks.NetworksIpV6Test.test_show_network [0.175006s] ... ok
{16} tempest.api.network.test_networks.NetworksTest.test_show_subnet [0.151536s] ... ok
{17} tempest.api.network.test_networks.NetworksIpV6Test.test_show_subnet [0.188223s] ... ok
{20} tempest.api.compute.security_groups.test_security_group_rules.SecurityGroupRulesTestJSON.test_security_group_rules_list [3.139465s] ... ok
{19} tempest.api.network.test_floating_ips.FloatingIPTestJSON.test_create_floating_ip_specifying_a_fixed_ip_address [3.994492s] ... ok
{14} tempest.api.network.test_ports.PortsIpV6TestJSON.test_create_port_with_no_securitygroups [3.117715s] ... ok
{25} tempest.api.compute.security_groups.test_security_groups.SecurityGroupsTestJSON.test_security_groups_create_list_delete [5.937458s] ... ok
{12} tempest.api.network.test_security_groups.SecGroupIPv6Test.test_create_show_delete_security_group_rule [6.502233s] ... ok
{12} tempest.api.network.test_security_groups.SecGroupIPv6Test.test_list_security_groups [0.093009s] ... ok
{13} tempest.api.network.test_security_groups.SecGroupTest.test_create_show_delete_security_group_rule [7.112194s] ... ok
{13} tempest.api.network.test_security_groups.SecGroupTest.test_list_security_groups [0.054745s] ... ok
{15} tempest.api.network.test_ports.PortsTestJSON.test_create_port_with_no_securitygroups [3.582728s] ... ok
{14} tempest.api.network.test_ports.PortsIpV6TestJSON.test_create_update_delete_port [1.314291s] ... ok
{11} tempest.api.network.test_extensions.ExtensionsTestJSON.test_list_show_extensions [18.574444s] ... ok
{14} tempest.api.network.test_ports.PortsIpV6TestJSON.test_list_ports [0.109275s] ... ok
{14} tempest.api.network.test_ports.PortsIpV6TestJSON.test_show_port [0.036114s] ... ok
{9} tempest.api.network.test_networks.BulkNetworkOpsTest.test_bulk_create_delete_subnet [3.799736s] ... ok
{10} tempest.api.network.test_networks.BulkNetworkOpsIpV6Test.test_bulk_create_delete_subnet [3.536136s] ... ok
{15} tempest.api.network.test_ports.PortsTestJSON.test_create_update_delete_port [1.307241s] ... ok
{15} tempest.api.network.test_ports.PortsTestJSON.test_list_ports [0.060077s] ... ok
{15} tempest.api.network.test_ports.PortsTestJSON.test_show_port [0.071514s] ... ok
{8} tempest.scenario.test_dashboard_basic_ops.TestDashboardBasicOps.test_basic_scenario [21.451737s] ... ok
{19} tempest.api.network.test_floating_ips.FloatingIPTestJSON.test_create_list_show_update_delete_floating_ip [4.159070s] ... ok
{6} tempest.api.network.test_routers.RoutersIpV6Test.test_add_multiple_router_interfaces [22.298589s] ... ok
{6} tempest.api.network.test_routers.RoutersIpV6Test.test_add_remove_router_interface_with_port_id [3.658506s] ... ok
{6} tempest.api.network.test_routers.RoutersIpV6Test.test_add_remove_router_interface_with_subnet_id [2.869718s] ... ok
{6} tempest.api.network.test_routers.RoutersIpV6Test.test_create_show_list_update_delete_router [2.555611s] ... ok
{38} tempest.api.compute.servers.test_server_addresses.ServerAddressesTestJSON.test_list_server_addresses [0.053950s] ... ok
{38} tempest.api.compute.servers.test_server_addresses.ServerAddressesTestJSON.test_list_server_addresses_by_network [0.104075s] ... ok
{4} tempest.api.network.test_routers.RoutersTest.test_add_multiple_router_interfaces [36.121210s] ... ok
{7} tempest.api.volume.test_volumes_get.VolumesGetTest.test_volume_create_get_update_delete_from_image [24.146985s] ... ok
{35} tempest.api.compute.servers.test_create_server.ServersTestManualDisk.test_list_servers [0.162800s] ... ok
{35} tempest.api.compute.servers.test_create_server.ServersTestManualDisk.test_verify_server_details [0.000412s] ... ok
{4} tempest.api.network.test_routers.RoutersTest.test_add_remove_router_interface_with_port_id [4.451978s] ... ok
{1} tempest.api.volume.test_volumes_actions.VolumesActionsTest.test_attach_detach_volume_to_instance [30.464461s] ... ok
{34} tempest.api.compute.servers.test_create_server.ServersTestJSON.test_list_servers [0.144789s] ... ok
{34} tempest.api.compute.servers.test_create_server.ServersTestJSON.test_verify_server_details [0.000886s] ... ok
{38} tempest.api.image.v2.test_versions.VersionsTest.test_list_versions [0.005152s] ... ok
{4} tempest.api.network.test_routers.RoutersTest.test_add_remove_router_interface_with_subnet_id [4.332545s] ... ok
{38} tempest.api.volume.test_versions.VersionsTest.test_list_versions [0.007957s] ... ok
{1} setUpClass (tempest.scenario.test_server_multinode.TestServerMultinode) ... SKIPPED: Less than 2 compute nodes, skipping multinode tests.
{4} tempest.api.network.test_routers.RoutersTest.test_create_show_list_update_delete_router [2.942549s] ... ok
{4} setUpClass (tempest.api.object_storage.test_container_quotas.ContainerQuotasTest) ... SKIPPED: ContainerQuotasTest skipped as swift is not available
{39} tempest.api.compute.servers.test_create_server.ServersTestBootFromVolume.test_list_servers [0.058296s] ... ok
{39} tempest.api.compute.servers.test_create_server.ServersTestBootFromVolume.test_verify_server_details [0.000426s] ... ok
{3} tempest.scenario.test_server_basic_ops.TestServerBasicOps.test_server_basic_ops [46.630860s] ... ok
{39} tempest.api.compute.test_versions.TestVersions.test_get_version_details [0.028967s] ... ok
{39} tempest.api.compute.test_versions.TestVersions.test_list_api_versions [0.009024s] ... ok
{0} tempest.api.compute.servers.test_attach_interfaces.AttachInterfacesUnderV243Test.test_add_remove_fixed_ip [55.377346s] ... ok
{0} setUpClass (tempest.api.object_storage.test_object_services.ObjectTest) ... SKIPPED: ObjectTest skipped as swift is not available
{5} tempest.api.compute.servers.test_server_actions.ServerActionsTestJSON.test_reboot_server_hard [19.463220s] ... ok
{39} tempest.api.volume.test_volumes_list.VolumesListTestJSON.test_volume_list [0.049473s] ... ok
{5} setUpClass (tempest.api.object_storage.test_account_quotas.AccountQuotasTest) ... SKIPPED: AccountQuotasTest skipped as swift is not available
{2} tempest.scenario.test_network_basic_ops.TestNetworkBasicOps.test_network_basic_ops [95.418302s] ... ok

======
Totals
======
Ran: 97 tests in 98.2119 sec.
 - Passed: 91
 - Skipped: 6
 - Expected Fail: 0
 - Unexpected Success: 0
 - Failed: 0
Sum of execute time for each test: 576.4096 sec.

==============
Worker Balance
==============
 - Worker 0 (2 tests) => 0:00:58.053686
 - Worker 1 (2 tests) => 0:00:35.224657
 - Worker 2 (2 tests) => 0:01:38.189928
 - Worker 3 (2 tests) => 0:01:07.386555
 - Worker 4 (5 tests) => 0:00:48.469064
 - Worker 5 (2 tests) => 0:00:28.660161
 - Worker 6 (4 tests) => 0:00:31.389893
 - Worker 7 (2 tests) => 0:00:36.835509
 - Worker 8 (1 tests) => 0:00:21.451737
 - Worker 9 (3 tests) => 0:00:18.975563
 - Worker 10 (3 tests) => 0:00:19.293597
 - Worker 11 (1 tests) => 0:00:18.574444
 - Worker 12 (3 tests) => 0:00:17.454231
 - Worker 13 (3 tests) => 0:00:17.596795
 - Worker 14 (5 tests) => 0:00:15.008236
 - Worker 15 (5 tests) => 0:00:16.199888
 - Worker 16 (6 tests) => 0:00:12.023364
 - Worker 17 (6 tests) => 0:00:11.607376
 - Worker 18 (1 tests) => 0:00:07.504554
 - Worker 19 (2 tests) => 0:00:08.162481
 - Worker 20 (2 tests) => 0:00:06.634405
 - Worker 21 (2 tests) => 0:00:02.748959
 - Worker 22 (1 tests) => 0:00:02.160909
 - Worker 23 (1 tests) => 0:00:02.336338
 - Worker 24 (3 tests) => 0:00:03.716390
 - Worker 25 (1 tests) => 0:00:05.937458
 - Worker 26 (1 tests) => 0:00:01.029370
 - Worker 27 (1 tests) => 0:00:00.891936
 - Worker 28 (4 tests) => 0:00:00.499985
 - Worker 29 (1 tests) => 0:00:00.441970
 - Worker 30 (1 tests) => 0:00:00.192477
 - Worker 31 (1 tests) => 0:00:00.508985
 - Worker 32 (1 tests) => 0:00:00.541137
 - Worker 33 (1 tests) => 0:00:00.335007
 - Worker 34 (2 tests) => 0:00:00.155741
 - Worker 35 (2 tests) => 0:00:00.169902
 - Worker 36 (2 tests) => 0:00:00.483020
 - Worker 37 (1 tests) => 0:00:00.179214
 - Worker 38 (4 tests) => 0:00:12.111866
 - Worker 39 (5 tests) => 0:00:17.204257
___________________________________ summary ____________________________________
  smoke: commands succeeded
  congratulations :)
